{
  "user_id": null,
  "alert_sec": 5,
  "clear_sec": 3,
  "repeat_sec": 240,
  "cooldown_sec": 60,
  "p_bad_threshold": null,
  "p_bad_hysteresis": 0.1,
  "shoulder_tilt_on": null,
  "shoulder_tilt_off": null,
  "distance_on_cm": 50,
  "distance_off_cm": 55,
  "calib_distance_cm": null,
  "camera_focal_px": null,
  "camera_hfov_deg": 63,
  "away_sec": 30,
  "sit_limit_min": 50,
  "sit_repeat_min": 10,
  "eye_break_min": 20,
  "notify_toast": true,
  "notify_sound": true,
  "notify_popup": true,
  "calib_sec": 10,
  "api_base_url": null,
  "api_token": null,
  "batch_interval_sec": 5,
  "batch_max": 100,
  "metrics_window_sec": 60
}